22,Pagamenti dell’amministrazione,15.08,Indicatore di tempestività  dei pagamenti,150801,Obbligo di pubblicazione relativo all'indicatore di tempestività  dei pagamenti,True,True,True,True,True,True,True,True,True,True,True,True,True,True,True,True,True,True,True,True,True,True,True,True,True,True,True,True,True,True,True,True,True,True,True,True,True
22,Pagamenti dell’amministrazione,15.08,Indicatore di tempestività  dei pagamenti,15080101,Obbligo di pubblicazione relativo all'indicatore trimestrale di tempestività  dei pagamenti,True,True,True,True,True,True,True,True,True,True,True,True,True,True,True,True,True,True,True,True,True,True,True,True,True,True,True,True,True,True,True,True,True,True,True,True,True
22,Pagamenti dell’amministrazione,15.08,Indicatore di tempestività  dei pagamenti,150802,Obbligo di pubblicazione relativo all'ammontare complessivo dei debiti,True,True,True,True,True,True,True,True,True,True,True,True,True,True,True,True,True,True,True,True,True,True,True,True,True,True,True,True,True,True,True,True,True,True,True,True,True
16,Opere pubbliche,16.01,Nuclei di valutazione e verifica degli investimenti pubblici,160101,Obbligo di pubblicazione relativo ai nuclei di valutazione e verifica degli investimenti pubblici ,True,True,True,True,True,True,True,True,True,True,True,True,True,True,True,True,True,True,True,True,True,True,True,True,True,True,True,True,True,True,True,True,True,True,True,True,True
16,Opere pubbliche,16.02,Atti di programmazione delle opere pubbliche,160201,Obbligo di pubblicazione degli atti di programmazione delle opere pubbliche,True,True,True,True,True,True,True,True,True,True,True,True,True,True,True,True,True,True,True,True,True,True,True,True,True,True,True,True,True,True,True,True,True,True,True,True,True
16,Opere pubbliche,16.03,Tempi costi e indicatori di realizzazione delle opere pubbliche,160301,"Obbligo di pubblicazione di tempi, costi unitari e indicatori di realizzazione delle opere pubbliche in corso o completate.",True,True,True,True,True,True,True,True,True,True,True,True,True,True,True,True,True,True,True,True,True,True,True,True,True,True,True,True,True,True,True,True,True,True,True,True,True
17,Pianificazione e governo del territorio,17.01,Pianificazione e governo del territorio,170101,Obbligo di trasparenza concernente gli atti di governo del territorio,True,True,True,True,True,True,True,True,True,True,True,True,True,True,True,True,True,True,True,True,False,True,True,True,True,True,True,True,True,True,True,True,True,True,True,True,True
17,Pianificazione e governo del territorio,17.01,Pianificazione e governo del territorio,170102,Obbligo di trasparenza concernente la documentazione relativa a ciascun procedimento di presentazione e approvazione delle proposte di trasformazione urbanistica,False,False,False,False,False,False,False,False,False,False,False,False,False,False,False,False,False,False,False,False,False,False,False,False,False,False,False,False,False,False,False,False,False,False,False,False,True
18,Informazioni ambientali,18.01,Informazioni ambientali,180101,Obbligo di pubblicazione delle informazioni ambientali,True,True,True,True,True,True,True,True,True,True,True,True,True,True,True,True,True,True,True,True,False,True,True,True,True,True,True,True,True,True,True,True,True,True,True,True,True
19,Strutture sanitarie private accreditate,19.01,Strutture sanitarie private accreditate,190101,Obbligo di pubblicazione concernente le strutture sanitarie private accreditate,False,False,False,False,False,False,False,False,False,False,False,False,False,False,True,True,True,True,True,True,False,True,True,True,True,True,True,True,True,True,True,True,True,True,True,True,False
20,Interventi straordinari e di emergenza,20.01,Interventi straordinari e di emergenza,200101,Obbligo di pubblicazione concernente gli interventi straordinari e di emergenza,True,True,True,True,True,True,True,True,True,True,True,True,True,True,True,True,True,True,True,True,False,True,True,True,True,True,True,True,True,True,True,True,True,True,True,True,True
21,Altri contenuti,21.01,Prevenzione della Corruzione,010101,Obbligo inerente la pubblicazione del Piano triennale per la prevenzione della corruzione e della trasparenza (PTCT),True,True,True,True,True,True,True,True,True,True,True,True,True,True,True,True,True,True,True,True,True,True,True,True,True,True,True,True,True,True,True,True,True,True,True,True,True
21,Altri contenuti,21.01,Prevenzione della Corruzione,210102,Obbligo di pubblicazione riguardante il responsabile della prevenzione della corruzione e della trasparenza,True,True,True,True,True,True,True,True,True,True,True,True,True,True,True,True,True,True,True,True,True,True,True,True,True,True,True,True,True,True,True,True,True,True,True,True,True
21,Altri contenuti,21.01,Prevenzione della Corruzione,210104,Obbligo di pubblicazione della relazione del responsabile della prevenzione della corruzione e della trasparenza ,True,True,True,True,True,True,True,True,True,True,True,True,True,True,True,True,True,True,True,True,True,True,True,True,True,True,True,True,True,True,True,True,True,True,True,True,True
21,Altri contenuti,21.01,Prevenzione della Corruzione,210105,Obbligo di pubblicazione dei provvedimenti adottati dall'A.N.AC. ,True,True,True,True,True,True,True,True,True,True,True,True,True,True,True,True,True,True,True,True,True,True,True,True,True,True,True,True,True,True,True,True,True,True,True,True,True
21,Altri contenuti,21.01,Prevenzione della Corruzione,210106,Obbligo di pubblicazione di atti di accertamento delle violazioni ,True,True,True,True,True,True,True,True,True,True,True,True,True,True,True,True,True,True,True,True,True,True,True,True,True,True,True,True,True,True,True,True,True,True,True,True,True
21,Altri contenuti,21.02,Accesso civico,210201,"Obbligo di pubblicazione concernente le richeste di accesso civico ""semplice""",True,True,True,True,True,True,True,True,True,True,True,True,True,True,True,True,True,True,True,True,True,True,True,True,True,True,True,True,True,True,True,True,True,True,True,True,True
21,Altri contenuti,21.02,Accesso civico,210202,"Obbligo di pubblicazione concernente le richeste di accesso civico ""generalizzato""",True,True,True,True,True,True,True,True,True,True,True,True,True,True,True,True,True,True,True,True,True,True,True,True,True,True,True,True,True,True,True,True,True,True,True,True,True
21,Altri contenuti,21.02,Accesso civico,210203,Obbligo di pubblicazione del registro degli accessi ,True,True,True,True,True,True,True,True,True,True,True,True,True,True,True,True,True,True,True,True,True,True,True,True,True,True,True,True,True,True,True,True,True,True,True,True,True
21,Altri contenuti,21.03,"Accessibilità  e Catalogo dei dati, metadati e banche dati",210301,"Obbligo di pubblicazione Catalogo dei dati, metadati e delle banche dati",True,True,True,True,True,True,True,True,True,True,True,True,True,True,True,True,True,True,True,True,True,True,True,True,True,True,True,True,True,True,True,True,True,True,True,True,True
21,Altri contenuti,21.03,"Accessibilità  e Catalogo dei dati, metadati e banche dati",210302,Obbligo di pubblicazione dei regolamenti su accesso telematico e il riutilizzo dei dati,True,True,True,True,True,True,True,True,True,True,True,True,True,True,True,True,True,True,True,True,True,True,True,True,True,True,True,True,True,True,True,True,True,True,True,True,True
21,Altri contenuti,21.03,"Accessibilità  e Catalogo dei dati, metadati e banche dati",210303,Obbligo di pubblicazione di obiettivi di accessibilità ,True,True,True,True,True,True,True,True,True,True,True,True,True,True,True,True,True,True,True,True,True,True,True,True,True,True,True,True,True,True,True,True,True,True,True,True,True
